{
  "generated_at": "2026-07-11T00:00:00Z",
  "generation_command": "python3 scripts/statedd_profile_metrics.py --output docs/metrics/profile_metrics.json --template-commit 2248f1edd656d58869f700e0419c9f32d06929ea",
  "profiles": [
    {
      "actual_tokens": 88288,
      "contexts": {
        "architecture_audit": {
          "actual_tokens": 5279,
          "estimated_tokens": 5461,
          "file_count": 7,
          "included_files": [
            "AGENTS.md",
            "STATUS.md",
            "NEXT_ACTIONS.md",
            "PROJECT_STATE.yaml",
            "PROJECT_DNA.yaml",
            "EFFICIENCY_BUDGET.yaml",
            "profiles/catalog.json"
          ],
          "missing_optional_files": [],
          "requested_files": [
            "AGENTS.md",
            "STATUS.md",
            "NEXT_ACTIONS.md",
            "PROJECT_STATE.yaml",
            "PROJECT_DNA.yaml",
            "EFFICIENCY_BUDGET.yaml",
            "profiles/catalog.json"
          ],
          "total_bytes": 21839
        },
        "ci_diagnosis": {
          "actual_tokens": 7361,
          "estimated_tokens": 8506,
          "file_count": 5,
          "included_files": [
            "AGENTS.md",
            "STATUS.md",
            "NEXT_ACTIONS.md",
            "PROJECT_STATE.yaml",
            "scripts/statedd_quality_gate.py"
          ],
          "missing_optional_files": [
            ".github/workflows/validate.yml"
          ],
          "requested_files": [
            "AGENTS.md",
            "STATUS.md",
            "NEXT_ACTIONS.md",
            "PROJECT_STATE.yaml",
            ".github/workflows/validate.yml",
            "scripts/statedd_quality_gate.py"
          ],
          "total_bytes": 34018
        },
        "closure_review": {
          "actual_tokens": 1918,
          "estimated_tokens": 2086,
          "file_count": 4,
          "included_files": [
            "AGENTS.md",
            "STATUS.md",
            "NEXT_ACTIONS.md",
            "PROJECT_STATE.yaml"
          ],
          "missing_optional_files": [
            "prompts/EVIDENCE_README_TEMPLATE.md"
          ],
          "requested_files": [
            "AGENTS.md",
            "STATUS.md",
            "NEXT_ACTIONS.md",
            "PROJECT_STATE.yaml",
            "prompts/EVIDENCE_README_TEMPLATE.md"
          ],
          "total_bytes": 8340
        },
        "initial_orientation": {
          "actual_tokens": 1918,
          "estimated_tokens": 2086,
          "file_count": 4,
          "included_files": [
            "AGENTS.md",
            "STATUS.md",
            "NEXT_ACTIONS.md",
            "PROJECT_STATE.yaml"
          ],
          "missing_optional_files": [],
          "requested_files": [
            "AGENTS.md",
            "STATUS.md",
            "NEXT_ACTIONS.md",
            "PROJECT_STATE.yaml"
          ],
          "total_bytes": 8340
        },
        "interrupted_resume": {
          "actual_tokens": 1918,
          "estimated_tokens": 2086,
          "file_count": 4,
          "included_files": [
            "AGENTS.md",
            "STATUS.md",
            "NEXT_ACTIONS.md",
            "PROJECT_STATE.yaml"
          ],
          "missing_optional_files": [],
          "requested_files": [
            "AGENTS.md",
            "STATUS.md",
            "NEXT_ACTIONS.md",
            "PROJECT_STATE.yaml"
          ],
          "total_bytes": 8340
        },
        "normal_implementation": {
          "actual_tokens": 2312,
          "estimated_tokens": 2547,
          "file_count": 5,
          "included_files": [
            "AGENTS.md",
            "STATUS.md",
            "NEXT_ACTIONS.md",
            "PROJECT_STATE.yaml",
            "scripts/AGENTS.md"
          ],
          "missing_optional_files": [],
          "requested_files": [
            "AGENTS.md",
            "STATUS.md",
            "NEXT_ACTIONS.md",
            "PROJECT_STATE.yaml",
            "scripts/AGENTS.md"
          ],
          "total_bytes": 10184
        }
      },
      "estimated_tokens": 94480,
      "generated_file_count": 39,
      "profile": "minimal",
      "quality_gate": {
        "command": "python3 scripts/statedd_quality_gate.py --gate-level 1 --conformance",
        "exit_code": 0,
        "gate_level": 1,
        "result": "pass"
      },
      "required_gate_level": 1,
      "resolved_asset_sets": [
        "core"
      ],
      "startup_actual_tokens": 1918,
      "startup_bytes": 8340,
      "startup_estimated_tokens": 2086,
      "startup_file_count": 4,
      "total_bytes": 377869
    },
    {
      "actual_tokens": 172654,
      "contexts": {
        "architecture_audit": {
          "actual_tokens": 5289,
          "estimated_tokens": 5468,
          "file_count": 7,
          "included_files": [
            "AGENTS.md",
            "STATUS.md",
            "NEXT_ACTIONS.md",
            "PROJECT_STATE.yaml",
            "PROJECT_DNA.yaml",
            "EFFICIENCY_BUDGET.yaml",
            "profiles/catalog.json"
          ],
          "missing_optional_files": [],
          "requested_files": [
            "AGENTS.md",
            "STATUS.md",
            "NEXT_ACTIONS.md",
            "PROJECT_STATE.yaml",
            "PROJECT_DNA.yaml",
            "EFFICIENCY_BUDGET.yaml",
            "profiles/catalog.json"
          ],
          "total_bytes": 21866
        },
        "ci_diagnosis": {
          "actual_tokens": 7371,
          "estimated_tokens": 8513,
          "file_count": 5,
          "included_files": [
            "AGENTS.md",
            "STATUS.md",
            "NEXT_ACTIONS.md",
            "PROJECT_STATE.yaml",
            "scripts/statedd_quality_gate.py"
          ],
          "missing_optional_files": [
            ".github/workflows/validate.yml"
          ],
          "requested_files": [
            "AGENTS.md",
            "STATUS.md",
            "NEXT_ACTIONS.md",
            "PROJECT_STATE.yaml",
            ".github/workflows/validate.yml",
            "scripts/statedd_quality_gate.py"
          ],
          "total_bytes": 34048
        },
        "closure_review": {
          "actual_tokens": 2908,
          "estimated_tokens": 3126,
          "file_count": 5,
          "included_files": [
            "AGENTS.md",
            "STATUS.md",
            "NEXT_ACTIONS.md",
            "PROJECT_STATE.yaml",
            "prompts/EVIDENCE_README_TEMPLATE.md"
          ],
          "missing_optional_files": [],
          "requested_files": [
            "AGENTS.md",
            "STATUS.md",
            "NEXT_ACTIONS.md",
            "PROJECT_STATE.yaml",
            "prompts/EVIDENCE_README_TEMPLATE.md"
          ],
          "total_bytes": 12502
        },
        "initial_orientation": {
          "actual_tokens": 1928,
          "estimated_tokens": 2093,
          "file_count": 4,
          "included_files": [
            "AGENTS.md",
            "STATUS.md",
            "NEXT_ACTIONS.md",
            "PROJECT_STATE.yaml"
          ],
          "missing_optional_files": [],
          "requested_files": [
            "AGENTS.md",
            "STATUS.md",
            "NEXT_ACTIONS.md",
            "PROJECT_STATE.yaml"
          ],
          "total_bytes": 8370
        },
        "interrupted_resume": {
          "actual_tokens": 1928,
          "estimated_tokens": 2093,
          "file_count": 4,
          "included_files": [
            "AGENTS.md",
            "STATUS.md",
            "NEXT_ACTIONS.md",
            "PROJECT_STATE.yaml"
          ],
          "missing_optional_files": [],
          "requested_files": [
            "AGENTS.md",
            "STATUS.md",
            "NEXT_ACTIONS.md",
            "PROJECT_STATE.yaml"
          ],
          "total_bytes": 8370
        },
        "normal_implementation": {
          "actual_tokens": 2322,
          "estimated_tokens": 2554,
          "file_count": 5,
          "included_files": [
            "AGENTS.md",
            "STATUS.md",
            "NEXT_ACTIONS.md",
            "PROJECT_STATE.yaml",
            "scripts/AGENTS.md"
          ],
          "missing_optional_files": [],
          "requested_files": [
            "AGENTS.md",
            "STATUS.md",
            "NEXT_ACTIONS.md",
            "PROJECT_STATE.yaml",
            "scripts/AGENTS.md"
          ],
          "total_bytes": 10214
        }
      },
      "estimated_tokens": 185844,
      "generated_file_count": 73,
      "profile": "solo",
      "quality_gate": {
        "command": "python3 scripts/statedd_quality_gate.py --gate-level 1 --conformance",
        "exit_code": 0,
        "gate_level": 1,
        "result": "pass"
      },
      "required_gate_level": 1,
      "resolved_asset_sets": [
        "core",
        "proof"
      ],
      "startup_actual_tokens": 1928,
      "startup_bytes": 8370,
      "startup_estimated_tokens": 2093,
      "startup_file_count": 4,
      "total_bytes": 743270
    },
    {
      "actual_tokens": 222821,
      "contexts": {
        "architecture_audit": {
          "actual_tokens": 5293,
          "estimated_tokens": 5469,
          "file_count": 7,
          "included_files": [
            "AGENTS.md",
            "STATUS.md",
            "NEXT_ACTIONS.md",
            "PROJECT_STATE.yaml",
            "PROJECT_DNA.yaml",
            "EFFICIENCY_BUDGET.yaml",
            "profiles/catalog.json"
          ],
          "missing_optional_files": [],
          "requested_files": [
            "AGENTS.md",
            "STATUS.md",
            "NEXT_ACTIONS.md",
            "PROJECT_STATE.yaml",
            "PROJECT_DNA.yaml",
            "EFFICIENCY_BUDGET.yaml",
            "profiles/catalog.json"
          ],
          "total_bytes": 21869
        },
        "ci_diagnosis": {
          "actual_tokens": 7375,
          "estimated_tokens": 8514,
          "file_count": 5,
          "included_files": [
            "AGENTS.md",
            "STATUS.md",
            "NEXT_ACTIONS.md",
            "PROJECT_STATE.yaml",